doc_id,doc_type,compound,cleaned_text,extreme_type,topic
km48dx,post,0.9967,let tell lose weight tired cute big girl want attractive try many time get weight never work never stick figure hard discipline fast fix like liposuction tummy tuck know exercise reach goal realize try reach goal appease people know like food take process slow pace beat drum first start wear clothe size bad habit buy small clothing like would magically make look small world get rid polka dot strip black garment wear appear thin buy clothing think cute feel comfortable wear clothing pull tug make fit secret big girl need embrace change period tackle insecurity hate arm passion fat would swing wave people afar wear sleeveless shirt barely wear shirt self conscious wing use joke tell people red bull give wing lol know know wing smh one morning wake brush tooth stare naked mirror tell fuck love flap wing like bird kiss look post baby droopy stomach caress tell stomach beautiful stretch mark child autograph name bacon egg cheese stretch mark remind bacon odd reason make people laugh till comfortable look thigh grab yell cell like mirror make laugh think always unless choose change still mirror ritual come ride bus extremely hungry feel stomach back conversation get bus opportunity get food new fuck love want food want feel bloated uncomfortable full cute ass outfit remember think omg actually think cute today really feel good much feel good hamburger soooo proud determined feel good everyday start experiment food portion see small portion could eat still satisfied pay attention food eat effect body food cause bloat heavy menstrual greasy food etc weight loss journey begin find exercise bore make play list favorite twerke song dance till drench sweat sweep instead vacuuming use stair instead elevator take stair two time curl gallon milk wait check grocery store squat pick toy leave living room floor run get mail run back start small change start see big soon start feel cute lot thing like eat unhealthy food would ruin work feel people never interested sudden lose weight like way people encouraging people feel good stay stuck past get place feel good enough stay disciplined stick goal love diet work,most_positive,4
14d28kb,post,-0.9913,since ozempic news healthy people somehow piss listen update expect blow glad get many people want say want correct one thing life style change focus lot relationship food plateaue hard endocrinologist help fix testosterone get ozempic help break plateau able maintain current weight minimal effort max hover thank ozempic drop fast people tell stop lose weight look haggard exact people spend whole life tell lose weight fuck even family people treat differently insanely infuriate person reality whatever reason obesity easy boogeyman cure simple right eat less move fucking clue inner working disease affect fucking cellular level ozempic novelty drug restrict people never able lose weight successfully suddenly covid change life get old maybe fuck semaglutide drug finally address obesity multi prong attack wreck cns cvs risky titrate properly unlucky one specific form thyroid cancer besides good make lifestyle change help mental health professional weight work much well long run either way regardless ozempic study prove people get semaglutide put back baseline amount weight spend half fucking life odd lbs big fucking deal sorry lot anger people get fucking moral failure fucking disease mean control blood pressure reduce stress calm work right heart problem chilllax boi bring heart rate fuck stupid stupid thank asshole use lose lbs get shitty middle aged suburbia cocktail party fit shit suit dress guess choice make physiological psychological force play barely even understand yet future laugh usual like treat substance use disorder like crime fucking stupid tldr fuck ozempic save life make huge amount people finally beat disease grow rapidly devastating consequence long run odd lbs lose yet still stick odd lbs bullshit fuck unless carry weight live lose shut fuck much love guy bug much,most_negative,4
nll5oj6,comment,-0.9853,motivation pure spite spite people think lose weight pco spite pharmaceutical company try sell think lose weight without lbs naturally spite people really believe genetically predispose fat obesity run family deep south lbs normal bmi spite people use mental health trauma excuse lose weight ptsd anxiety depression seizure neurological deficit result traumatic brain injury spite girl bring know goal weight due height physically achieve halfway already skinny one lolz literally anybody else every reason still,most_negative,4
1fh0udy,post,-0.9796,think starve little little hard lose weight feel like gain weight super fast lose gain weight every year eat normal rarely eat fast food drink soda understand think try ozempic wegovy everyone discourage say could bad circumstance family get gain weight tell lose weight lose friend comment arm get big need start lift weight try try weight training high protein diet work come point decide starve little everyday look mirror absolutely disgusted hip dip make want puke low belly fat make want puke back fat make hate cellulose leg make shameful baby shower scared people see year think even think liposuction people say waste hate shop find clothe either fit make shape look weird context currently bust waist hip,most_negative,4
1ffc1dh,post,0.9994,lose lbs food eat lose picture allow sub want see body transformation post cico thing start heavily practice cico opinion cico law need treat objective truth food eat help limit caloric intake win see fruit vegetable list feel like obvious enough fruit vegetable fantastic eat enough try pick food outside obvious additional context old male start journey calorie goal eat around calorie consistently adjust lose weight sit dannon light fit nonfat vanilla greek yogurt kashi cinnamon crisp cereal eat thing together nearly daily yogurt calorie per protein cereal calorie per protein make bowl serving yogurt cereal total calorie protein potatoe sweet potato personal favorite eat gold red purple russet white fine well like well potato one satiate food planet mean eat little feel incredibly full also rich vitamin potassium fiber eat skin would cut cube drizzle lightly oil season roast oven minute depend many cookie sheet regardless whatever potato use safely assume every trader joe shawarma chicken thigh personal favorite dinner tender flavorful come pre seasoned pre marinated toss oven grill enjoy cal chicken usually decent enough serve calorie high sodium get good sweat next workout good pork tenderloin personal favorite macro incredible specific brand love generally buy pre marinated one smithfield trader joe aldi jewel osco depend flavor generally calorie per pork protein typically dinner eat pork calorie would get protein chicken thigh high sodium make sure get good sweat occasionally zero calorie zero sugar soda water flavoring dude tell chug definitely try drink much plain water possible cut okay something like crystal light add fruit punch flavoring water diet soda fine people tell diet soda bad regular soda fuck end weight loss game calorie diet soda calorie people usually get trouble drink diet soda might make want food manage golden jimmy john eat much jimmy john might new jared subway minus kid diddling jimmy john lobby office building sandwich get lunch regular turkey tom white mayonnaise add cucumber extra jimmy pepper extra onion extra pickle extra mustard oil vinegar oregano basil total calorie want hearty sandwich thing regular bootlegger club white mayonnaise add cucumber extra jimmy pepper extra onion extra pickle extra mustard oil vinegar oregano basil total calorie main difference bootlegger meat scoop bread turkey tom fat free cottage cheese like greek yogurt cottage cheese cheat code come macros would still eat directly tub spoon taste texture cottage cheese greatly vary advice find brand like good calorie count protein stick personal favorite jewel osco house brand lucerne farm calorie per protein also like trader joe fat free cottage cheese quaker rice crisp stuff list substantial food sometimes wanna snack like one look guilty free snack depend flavor pick apple cinnamon caramel cheddar personal favorite generally calorie serve serving bag eat whole bag calorie really good value imo whenever want gorge quaker normal rice cake also good value calorie cake think crisp well taste chip like well satisfy snack feeling outshine sugar add popsicle good diet popsicle hand outshine make popsicle real fruit juice expensive value brand sugar free popsicle worth imo outshine popsicle calorie insane value number time sit bed watch eat popsicle popsicle artificial sweetener tendency make people gassy definitely get gassy take fart calorie sugar free lite condiment dressing people often shocked learn many calorie sauce dressing opt lot sugar free lite option favorite sweet baby ray sugar add bbq sauce flavor ray good job imo make sugar free bbq sauce still thick close original flavor hughe sauce marinade sugar free usually calorie per tablespoon kraft lite dressings raspberry balsamic vinaigrette favorite cal per tablespoon hope list help form fashion big thing good stay disciplined discipline beat motivation motivation tired change win happen overnight many night work hard stay happen way happen happy answer additional question time,most_positive,3
ncmov5i,comment,0.9983,care much great start endocrinologist medicare probably need see plan pay get see endo get onto medication help manage glucose response could helpful put mounjaro something similar cover might able control level eat carb without drug might also find see doctor doctor prescribe certain diet make easy wife give healthy food say sorry doctor say deflection two fil spend first couple mad need eat vegetable lot people mitigate spike eat food order high fiber veggie first protein something carb slow digesting start dinner salad always good way get fiber eat anything else sound like might need bargaining like would kid yes corn eat salad meat budget allow would suggest try dish low carb mean low total carb net carb game really work sauce condiment surprising example many carb regular ketchup make sub carb friendly option help least limit fil ingest brand like different thing hughe kind sauce get fil stir fry include excellent honey mustard sauce also double nicely amazing salad dressing plus bbq teriyaki stir fry sauce lot thing put chicken dress protein also like baby ray sugar free sauce bbq honey mustard wicked snack baked good look simple mill item make almond flour mix muffin banana bread low glycemic index like nice salad bowl homemade soup pumpkin spice muffin sound diety fil make snack bar cookie well find many walmart decent selection walmart vary might take trip different store area roam aisle find diabetic option good alternative ketchup like heinz sugar add hughe one well huge ketchup fan carb per serve carb esp usually serving significant difference meal keto sauce also usually good option diabetic watch net carb funny math much fruit spike diabetic really helpful get cgm back enough finger stick meal figure thing spike interesting note many eat portion ice cream without spike high fat content usually help exercise front strong proponent recumbent bike esp old folk comfortable mean excuse get meal rain darkness snow heat wildfire smoke none matter handy bike ipad nearby entertainment marcy inexpensive effective interested model recommendation get fil bike walk even min meal esp dinner help,most_positive,3
1kmg7o1,post,0.9963,happy ago diabetic distress eat whatever want close remission one get disease take metformin need share fucking proud edit people ask get reddit let respond try type hello late response cause get overwhelmed lol want share still walk every meal actually usually real put show youtube video walk back forth play minute allow sit also try walk every single though least hour try hit step many unless really sick something allow step per bulk exercise also gym occasionally work way anxiety thing like weight minute cardio bike elliptical time home weight use couple time thing like bicep curl hammer curl lateral raise room also dance frequently bore nothing serious lol literally put music little boogie room also count clean exercise deep clean bathroom kitchen quite workout food consider modify version keto main nutrition goal get fibre protein worry much fat come balanced varied source eat lot bacon even though fit keto diet well carb come form vegetable head call high pro file diet lol look dinner plate goal half two third high fibre vegetable one half one third protein fat use medium sized dinner plate lunch breakfast supplement snack throughout breakfast vary base previous eat feel need start common meal include bunless hot dog look nutrition label carb though brand surprisingly high serve sauerkraut mustard pot roast chicken thigh marinate yogurt spice roast oven cruciferous vegetable primarily broccoli brussel sprout roast olive oil spice low sugar yogurt berry sandwich make carbonaut bread trust brand also slice quesadilla make low carb tortillas brand result vary something like make half moon instead full moon serve side veggie non breaded buffalo wing veggie blue ranch whole bunch something like chicken wing veggie usually would see lot wing veggie plate restaurant swap around match plate rule lot easy way make food love diabetes safe grow eat cabbage roll typically carb heavy rice tomato sauce sometimes add sugar people might choose replace something like cauli rice honestly like water content add usually omit rice altogether find recipe work low carb way take trial error sometimes almost always way snacky person always one issue snack allow little restriction olive pickle boil egg devil egg veggie dip sure pick low carb one ofc one restriction still great way beef jerky meat stick always double check nutrition label carb nut ofc good also super high calorie low sugar yogurt cup low sugar sugar cheese string category instead low restriction one eat entire bag one sitting also cheat snack real cheat log way head help avoid actually cheat diet allow unless period point allow one sanity everyone around lol primarily sugar add chocolate bar sugar add gummie sugar add ice cream quest chip sometimes really need fill junk void always check nutrition label ingredient sneaky carb sometimes also want keep eye certain sweetener primarily malitol anything end ulose make poop pantaloon careful ofc also need live life certain food allow actually cheat treat every holiday time exception birthday halloween christmas little crazy movie theatre always allow bit popcorn also real cheat learn lot worth exception course generally strict family mcdonald long drive get dang mcdouble count towards monthly cheat really want long happen frequently okay get torture nothing diet coke car everyone around eat mcnugget quarter pounder note restaurant usually actually hard lot place non breaded wing buffalo sauce sell burger let get bun ask salad try get one mayo yogurt base dress rather something like vinaigrette avoid dry fruit place really struggle italian restaurant thing like chinese takeout ayce sushi great option like raw fish usually dinner lunch often sashimi food avoid pasta pastry sweet rice noodle potato etc even allow eat carb cheat meal usually include time rather good fry chicken sandwich break diet family close friend dinner order one though might ask single bite try food nearly fully restrict pasta suck love pasta lol people eat plate usually like serving even one actual serve spike high stay pee night worth would break rule two thing incredibly high quality fresh pasta really good baked mac cheese part specific spike might spike someone else think gist kind long response lol usually live life,most_positive,3
lj1d4uh,comment,-0.9686,take briefly right state slow metabolism severely restrict calorie also still eat carbs sugar eat carbs sugar raise insulin prevent body fat use energy calorie body fat nothing use energy body slow metabolism require less keep alive need wegovy stop hunger put ketosis get ketosis naturally instead severely cut back carb sugar increase fat protein vegetable healthy fat unhealthy fat unhealthy fat seed oil ultra process food restaurant cook etc canola oil sunflower oil vegetable oil stop eat product contain oil unstable heat manufacturing cooking lead high cholesterol associate damage healthy extra virgin olive oil avocado oil ghee butter full fat greek yogurt whole millk cheese cheese string actual cheese like cheddar pregrate either avocado salmon mackerel start eat protein chicken lamb beef egg etc also eat fat stable inflammatory fat also improve cholesterol apart one ldl problem people unhealthy get high ldl damage fat high ldl non damaging fat also mobilise body fat energy,most_negative,3
nlaaon4,comment,-0.9517,start find sedentary tdee eat maintenance every subtract calorie daily limit calorie deficit stay calorie deficit remainder diet process try burn calorie cardio walk recommend minimum step count make easy cut process food completely try mainly eat whole food single ingredient portion cronometer good calorie tracking app consitancy cheat meal ruin entire accidentally mess blow diet get wagon continue plan eventually get tired restart lose pound year like lose pound pound add need lifestyle change weight loss side effect,most_negative,3
nlaapbu,comment,-0.9517,start find sedentary tdee eat maintenance every subtract calorie daily limit calorie deficit stay calorie deficit remainder diet process try burn calorie cardio walk recommend minimum step count make easy cut process food completely try mainly eat whole food single ingredient portion cronometer good calorie tracking app consitancy cheat meal ruin entire accidentally mess blow diet get wagon continue plan eventually get tired restart lose pound year like lose pound pound add need lifestyle change weight loss side effect,most_negative,3
logdg3t,comment,0.9442,wow great progress could share diet exercise routine detect haikus sometimes successfully learn opt reply haikusbot opt delete comment haikusbot delete,most_positive,1
lnbeqn1,comment,0.9393,happy amazing look beautiful congrat detect haikus sometimes successfully learn opt reply haikusbot opt delete comment haikusbot delete,most_positive,1
lgos1vt,comment,0.9001,congratulation journey thank motivation detect haikus sometimes successfully learn opt reply haikusbot opt delete comment haikusbot delete,most_positive,1
lhzyt3d,comment,-0.926,mod team find comment appear bully harassment continue violation rule may result additional action include ban,most_negative,1
lhzytx2,comment,-0.926,mod team find comment appear bully harassment continue violation rule may result additional action include ban,most_negative,1
mnqritx,comment,-0.926,mod team find comment appear bully harassment continue violation rule may result additional action include ban,most_negative,1
