doc_id,doc_type,compound,cleaned_text,extreme_type,topic
1oh7cqs,post,0.9993,love letter wegovy extremely proud definitely easy much energy confident also take blood pressure medication ago take different blood pressure medication take blood pressure medication bonus lab look great look beautiful want completely transparent honest always huge binger binge eater bad numerous way include limit mentally spiritually emotionally financially eat meal would already eagerly anticipate next meal snack especially night put youngin bed would eat eat eat point stomach would much pain night would throw purpose definitely bulimia instead would throw stuff stomach obviously eat way much even still would continue eat eat real actual hunger food help feel well mask hide emotion everything notice much patient empathetic compassionate also give grace toddler also complete stranger smile time folk reciprocate smile small talk importantly least much well healthy mother strong willed loved much always want active year old toddler lol actively play include chase hide seek run playground zoo etc thing hardly active minute honestly think several different thing lifestyle change daily exercise meal planning loghe chart track everything mynetdiary app well meal prep plus miraculous glorious wegovy last absolute hard food noise start creep back also coincide ovulation follow pcp amazing discuss side effect let know yes lose weight food noise come back vengeance agree next dose far nothing short miracle gor another follow pcp determined lose another least see combine reason happy healthy patience woman smbc solo mother choice lose total lbs september lbs lbs total lbs huge add bonus much pain make feel tremendously well even though lbs far versus even take year old minute walk also take park actively play entire time could play minute park sit typically sit phone rest time park also even though lose lbs see much change physically still wear clothe ago physically feel well energy stamina kind try remind gain weight instantly overnight take year get lbs total amazing honestly never think would get try always attitude gratitude like toddler magically able control emotion outburst tantrum immediately take patience compassion empathy understanding ability recognize unfortunately sometimes life fair betty street eat ginormous ungodly amount food least see yet still weigh high school ugh trigger devastating caution thought remind zero clue behind closed door maybe depressed maybe extremely abusive relationship maybe medical condition wish could gain weight maybe drug burn extra calorie maybe bulimic maybe plastic surgery hand maybe eat omad huge portion full calorie happen see maybe also regardless reason please try remind journey life decision lifestyle choice everything choose consume none business nothing remember never okay comment another woman body unless untill walk mile shoe need mind biscuit life gravy stop compare life journey beautifully uniquely comparison thief joy instead sit lay around bemoan waste life actively participate life long spectator mine year old live instead active willing participant mine toddler live track log everything include water mynetdiary app use free version awesome also enter food meal drink eat drink way able stick less calorie add remove consume also bar code scanner use also free easily see nutrient fact include serve size etc also add step per exercise sleep medication etc free bother pay free version work well get strong beautiful brave weight loss warrior queen love south alabama,most_positive,0
j9i8ag,post,0.9993,general guide need start weight loss journey answer question people put volume attempt edit thank award much appreciate also add quote diet meet think would cool add edit remove intro since original guide pin anymore save lot extra reading skip text thank award give much appreciate disclaimer end bloke internet bias opinion knowledge perfect ability write dietician tell food eat advise calorie intake macro intake want food plan advise see dietician register govern body lot nutritionist claim dietician also doubt health preexist medical condition injury need see doctor first also exercise put suggestion check form sure form exercise research film see wrong lot sub reddit submit video check form get friendly advice general guide need start weight loss journey answer question people put attempt key note wanna read healthy calorie deficit applicable activity want lose weight scale end weight loss work tdee calorie realistic activity less distance walk travel move around sedentary lifestyle keep mind say much workout scale end weight loss time night eat matter scale end weight loss take body measurement photo journal must one photo underwear one outfit sometimes critical eye see actually change outfit scale end weight loss exercise lose weight help hell lot scale end weight loss move whatever exercise regularly good exercise aware yoga everyday win burn crossfit class scale end weight loss process take long time consistent effort expect change scale end weight loss measure gravity ground factor change body composition far important end goal weight bad thing gospel well far long wind stuff calorie lose weight simple principle energy expenditure must expend consume simple calorie deficit correctly lose weight even suffer something like pco work sometimes notice client work slow excuse work adult recommend calorie deficit maintenance calorie year old recommend calorie still grow small deficit well increase kid physical activity lot time need child deficit add slow weight loss usually sign good weight loss good habit ingrain life healthy calorie deficit average person calorie deficit pretty pointless usually sustainable exception doctor recommendation bodybuilder morbidly obese may likely need big deficit calorie normally eat would advise calculate calorie maintenance compare calorie eat far bring maintenance calorie first adapt healthy level calorie add deficit well typically people help eat excess calorie plus eat maintain current weight calculate calorie recommend calculator perfect calculator job reliably enough one recommend total daily energy expenditure tdee estimation many calorie burn per exercise take account calculate first figure basal metabolic rate bmr basically calorie body require function healthily multiply value activity multiplier since bmr represent many calorie body burn rest necessary adjust number upwards account calorie burn true even sedentary lifestyle freak high expect remember slow steady weight loss good choose activity level personal belief teach travel cover foot walk format exercise general activity sedentary cover distance drop activity one level may workout time heavy exercise sit butt office job moderate exercise choice probably wise calculation info put accurate mind able put body fat percentage calorie suggestion accurate preferred method measure body fat like point calip test need someone know accurate even know properly variable even still recommend bio electrical impedance vary widely depend body shape think pear shaped people hydration take fitbit aria massive pinch salt wait every see mate know point test worry much figure body fat percentage though general body composition along important whether change well kid worry measure unless doctor request aware specifically use calculator workout tdee follow fitness tracker tdee take daily life exercise equation add exercise calorie allowance already keep tdee tracker also aware lose weight need check tdee lose enough need work tdee aware weight loss slow plateaus track eat main two app website myfitnesspal loseit good regularly correct update personally use myfitnessspal quite simple log eat preferably time eat remember properly food prep mean everything include biscuit one work college offer pass also aware log liquid calorie well drink lot smoothie cordial fruit juice soda coffee milk sugar still calorie especially like latte make sure log well many time eat well liquid ruin progress genuinely past client change nothing food apart drop drink apart water lose please look everything conjunction use one app need good set scale preferably digital opinion accurately put eat high chance eat proper deficit accurately log eat ever say accurate diet study show time time people underestimate eat greatly would trust portion size packaging well time match put packet example plain wrap could say wrap calorie packaging end serve calorie lot difference calorie build multiple meal easily meal calorie difference real change especially plan deficit calorie community say track food cause eat disorder realistic truth keep track eat way reasonable accuracy chance overeat lose weight fault diet culture anything like responsibility pretty sensible diet work get used know inside start eyeball portion one want stick scale time cook forever recommend high volume low calorie food object use know within reasonable amount accuracy amount tiny measure jug portion rice pasta know level right uncooked also admittedly allow inaccuracy diet assumption eyeballing always overestimate cover stop disappointment diet iterate enough one sustain good diet honestly matter follow slimmer world keto intermittent fasting kinda one anything thing else like say deficit lose weight healthy balanced diet preferable wholly necessary come lose weight recommend personally think good thing food calorie work use macro break breakdown much protein fat carb eat app track add seem overly complicated feel much bother think good idea especially try form exercise tone physique would protein fat carb break protein fat help feel full long generally satisfied eat protein also help keep muscle mass lose weight bit bro science also kinda true especially exercise regularly part make sure eat quota protein worry much break fat carb long hit calorie goal admittedly though always feel satisfied keep macro break state use fast hour feed hour girlfriend little one really work well though quite often eat eat vegetarian tell never one another story like able sit eat chat dinner table instead sit like pleb away sofa typically small lunch biggish evening meal snack little rough version intermittent fasting work dietitian meet cool chat say add guide clear thing could tell eat eat kinda job end make food plan put calorie plan lose weight maintain weight gain weight depend medically need deal lot nhs work perfect world tell never eat bacon pretty bad king delicious know eat like eat slice win kill little everything fine excess anything bad stop complicate eat meat veggie fruit nut fat carbs protein junk lot one thing stay hydrated many time people moan hungry dam time dehydrate know eat calorie bracket macro recipe help fairly good choose amount meal want well snack come idea well even let get rid food like mushroom choose diet plan like keto etc help much possible far aware still free dietician say eat please ask government body register dietician something like otherwise link pretty good review peer old client scale weight loss measurement scale end weight loss really good guide help show downward trend dictate success failure well scale equipment measure relation earth gravity forever make cry sleep use pinch salt please beg aim lose certain amount aim lose accept temporary measure lifestyle change take long time accept plan long term screw beach body ready crap along scale recommend take photo underwear also photo one particular outfit well take body measurement tape measure youtube old cheesy explain use tape measure pretty well ignore caliper section pretty naff regular take measurement would recommend scale take photo underwear time stand scale repeatedly throughout find weight fluctuate much hour take measurement tape measure photo select outfit would recommend take every try always keep interval consistency lady natural cycle affect weight greatly probably already know try forget scale mess around bit explain well male like leave lady read another trainer respect speed weight loss unfortunate truth weight loss fast good time plateaus often strap long haul loss sometimes even barely register scale remember still downward trend matter small thing plateaue freak breathe look plateau look past measurement photo see change especially beginning look well eat accurately track eat common issue eyeballing skill regular food eat physical activity drop late life work get way sometimes need evaluate tdee temporally activity low one good cause plateau since lose weight tdee drop common reason lose weight tdee drop normal weight loss fluid thing calorie aware adapt necessary exercise honest exercise enjoy regularly important thing exercise enjoy time win keep simple aware yoga win burn much crossfit class stuck idea simple circuit require lot space would advise make sure warm exercise recommend follow one quick easy get job recommend darebee workout idea general ever stick follow workout pretty simple follow format try circuit min rest circuit matter couple circuit start workout exercise rep squat reverse lunge press tricep dip chair similar stable object jump squat plank hold sec workout exercise rep walk lunge jump squat step press sprint spot secs crunch workout exercise rep burpee try include press plank sec press squat bicycle crunch jump lunge workout one bit hard rest see challenge exercise rep burpee press jump squat tricep dip chair similar stable object walking lunge sprint spot sec exercise please look properly make sure know properly afraid make exercise easy hard need workout make sure cool stretch properly enough cover muscle group supplement long story short need protein powder help get protein quota good multi vit keep fat burner fat metabolizor fat remover crap say help burn fat chance waste money well spend elsewhere come supplement much say honest think need much unless train something specific bother look unless trainer use personally advise otherwise ask nutrition supplement reddit info ouff well lot text hope well old one explain thing bit clearly grammar spelling awful probably dyslexia english mix lol thank much could manage drag far terrible writing skill hope help,most_positive,0
nll9mbz,comment,0.9991,copy paste comment use whole host new people question particularly read dose guideline might thing help well general comment first time user starter people look advice hope help congratulation take big first step remember whole process marathon sprint offer advice help journey give countless people time group time ozempic wegovy first expect miracle result overnight everyone timeline result people see result overnight people see result high next recommend dose guideline ozempic minimum dose accord official ozempic website information strongly recommend increase time etc find click chart online specific pen size customize dose example increment dosing pen click stay dose minimum dose still give good result stay dose fill two guideline maximize overall effectiveness ozempic time well minimize potential side effect increase next dose current one lose effectiveness need follow titration schedule risk serious side effect schedule exist first place also injection usually belly people thigh make sure pinch skin good amount fatty tissue inject area hold needle injection finish click extra count least second make sure medication dispense thirdly figure bmr tdee google calculator online give right amount calorie safely consume order lose weight still get adequate nutrition calorie need survive also need track food keep count calorie eat stay range recommend find good app like personally favorite loseit many great option track food stay calorie deficit key success try prioritize protein fiber much within meal lot great creative way add diet feel like eat protein shake great way get calorie protein always powder premade find fairlife premier protein good far powder find good thing get trial size one figure one like like well buy whole bag drink lot water emphasize enough need drink much reasonably ozempic dehydrate water essential weight loss excretion fat leave body remember add thing like crystal lite mio lemon whatever else need order make water easy drink make count less water count also buy water bottle absolutely love help trick brain want body measurement time feel like scale move measure tape grateful also take picture something wish might hate look happy something compare later number one side effect people constipation diarrhea less common increase fiber intake help significantly personally really enjoy bran milk honey morning get hand remedy like restorlax etc help end diarrhea something like imodium help meditation cause diarrhea cancel offer lately another big side effect nausea ginger chew tea supplement help peppermint tea protein fiber bed give stomach something chew night gravol dramamine get really bad doctor prescribe hefty anti nausea med like zofran another common side effect hair loss happen decrease nutritional intake well rapid weight loss increase protein intake well supplemental help help nip bud work increase protein add biotin supplement yes sound crazy prenatal vitamin work hair almost back normal still lose probably miss something add edit line feel free ask question ozempic wegovy year drop stat underneath welcome congratulation height age october lbs,most_positive,0
n2jzavc,comment,-0.9961,cause muscle loss lose weight cause muscle loss lose weight increase suicidal ideation study study suicidal ideation one find perfective certain type people issue read mislead information dig deep denmark study adult cohort show reduction suicidal ideation sure continue think study warn double check lot depression past also doctor tell possible side effect first come per study break confound factor find instance people reduction incident compare people obesity medicine reduce recurrence suicidal ideation think want focus grieve also vice friend stop stop vice especially drug alcohol link increase suicide continue vice also link increase morbidity many thing include suicide treat lot thing treatment without risk non treatment either sorry happen suck lose someone awful especially way say get want doctor stop prescribe people read misleading article take year later die cardiovascular event preventable take drug commit suicide part untreated illness actually help someone effect mental health think need heal know people die leave note write whatever recent intrusive thought note really know struggle realize issue untreated intrusive thought issue untreated mental physical health issue abuse though something like suicide people past experience mental health issue think well grieve think get something would helpful,most_negative,0
hv28x7c,comment,-0.9944,warning people fibromyalgia take wegovy tirade wegovy drug lower blood sugar significantly dose start get bad muscle tension cramp spasm everywhere learn people normal blood sugar lose weight drug fibro constant low blood sugar cause muscle awful diabete want diabete constant low blood sugar level cause problem fibromyalgia jealous daily misery combat little sugar good diet fibro stay small dose worth daily fibromyalgia flare muscle tension knot spasm usually anyway fibro add wegovy friend every symptom already suffer skyrocket get high dose system take painkiller hate anyway eat sugar weird recover lyme disease sugar forbid level low terrible pain raise blood sugar try eat dry fruit fibro patient stay low dose wegovy worth believe mention cascade side effect dose heart palpation breathing issue dizzy vomiting nausea pain tired depressed anxiety low dose back want regain pound lose care lose careful use drug especially fibromyalgia,most_negative,0
mnijcdw,comment,-0.9931,may die complication diabetes likely stem liver transplant mean med take anti rejection med steroid cause diabete control turn cause death liver transplant cause liver transplant fail medication take hell even sick cause blood sugar drop spike may able get control pass away diabete alone kill liver transplant guarantee would fine right say warning die ultimate fear monger poor girl poor health,most_negative,0
m7q8lz2,comment,0.9867,small business owner essential anticipate trend adapt quickly stay connected customer base blame single factor like ozempic closure wine bar overlook broad responsibility remain flexible innovative ever change market consumer preference habit always shift whether due health trend economic change cultural shift successful small business owner analyze trend identify opportunity pivot need example notice grow interest wellness might introduce non alcoholic option craft mocktail even expand healthy food pairing key survive thriving stay proactive reactive small business owner stay customer centric regularly engage customer understand evolving preference feedback invaluable diversify offering avoid reliance one product trend broaden menu service experience appeal wide audience monitor trend pay attention market trend local national global adjust business strategy accordingly focus experience industry like hospitality product atmosphere connection create customer market effectively promote unique selling point educate customer value bring beyond obvious adapt always easy critical business thrive see change threat opportunity evolve,most_positive,2
l1rvouy,comment,0.985,agree certain point government become large customer beneficiary happen stage would think need consideration give good exchequer probably get point super natural profit earn government large customer flex muscle additionally health insurance cost incredibly high cover incredibly high drug cost case wonder element collusion drug company insurance company great example government intervention good public interest hugely favour less government rule area stick beak imho,most_positive,2
m860cvs,comment,0.9844,read somewhere insurance company often win cover unless diabete expensive medication produce health insurance company see long term benefit weight loss use drug like ozempic win approve unless type diabetic type diabetic get medication therefore unless willing able spend whatever screw messed health risk think minimal benefit far outweigh semaglutide actually good heart kidney organ weigh less good joint heart get insurance company asshole digress great job get want help medication,most_positive,2
jjwqz0h,comment,-0.9619,wegovy drug approve fda probably know probably also know insurance typically pay wegovy might pay ozempic criticism people take drug lose weight instead control type diabete perhaps address concern fda doctor prescribe label business use ozempic type diabete weight loss currently prediabete level treatment apologize comment hurtful please realize comment also hurtful people unkind say nasty thing people use drug weight loss personally agree misgiving use ozempic way express thought without jerk word nothing support add anything useful conversation thread unnecessary serve purpose bring sad take much time say something kind supportive nasty mean,most_negative,2
jpnfcob,comment,-0.9403,use word like cheat people break arm cheat use cast heal person cancer use chemotherapy cheat seek medical treatment pregnant woman get epidural give birth somehow cheat lord help toxic ass people,most_negative,2
mpfagy5,comment,-0.9275,ready downvote reddit decide mean ask sub ask random street understand want sub spread misinformation young body mind keep away stuff nothing stop kid google wikipedia ing find info elsewhere internet upvote downvote vet information country obesity problem put safeguard information porn cesspool remain open feel dumb mean teen ask safe sex drug targeted issue people reddit would chime scream wear condom drug also fact caloric deficit lead weight loss true eat anything lead death fear country usa country fail turn away interested lose currently,most_negative,2
1h1alkf,post,0.9979,ozempic year pic good morning happy early thanksgiving want share success open dialogue share celebrate victory well love see love accept wonderful community thank truly ozempic jan sept since stop keep diet eat moderation light exercise happy report weight continue drop honestly disbelief keep expect randomly gain back wake dream lol wfh huge need replace clothe however extended vacation holiday quickly realize three pair jean fit actually fit well thrift shopping expect one pant size two fit size expect still see big seem wrap head around change size body honestly blessed thankful ozempic quite literally save life ozempic cure still take hard work dedication want improve quality life take lot motivation discipline get result ozempic push body need able grateful,most_positive,4
kvh3a2c,comment,0.9972,firstly want acknowledge courage reach determination make positive change life important remember weight loss journey incredibly personal unique individual work someone else might work okay say one crucial aspect successful weight loss find truly motivate within desire skinny part essential cultivate deep understanding want lose weight focus healthy improve overall quality life boost confidence allow engage fully activity enjoy practical tip consider start small break goal manageable step celebrate achievement along way reestablish consistent gym routine even powerful first step additionally prioritize nutritious whole food diet try find enjoyable form physical activity look forward remember setback natural part journey kind practice self compassion navigate process surround supportive friend family even online community offer encouragement accountability ultimately important thing believe ability make positive change strength resilience overcome challenge confident achieve goal dedication persistence,most_positive,4
